rid,sentences__sentence__text,sentences__sentence__Opinions__Opinion__category,sentences__sentence__Opinions__Opinion__polarity
,"Fine, I wont hang you for that.",,
,"However, once I received my predictably mediocre order of what Dokebi thinks passes as Korean fair, (sometimes you have to settle when it's your only option), I got through about half my kimchee before I found a piece of random lettuce accompanied by a far more disgusting, slimy, clearly bad piece of fish skin.",FOOD#QUALITY,negative
,,FOOD#QUALITY,negative
,"Not one to jump to complaints (hence my lack of previous online reviewing), I called the restaurant to give them a heads up that their kitchen might want to check the cleanliness of their prep stations.",,
,"My main concern was the sanity of the food that was being sent out to myself and others, but I would be lying is I said that as someone who has worked in restaurants since the age of fifteen I was expecting at least a minimal effort on the part of the restaurant to amend the situation.",FOOD#QUALITY,negative
,,SERVICE#GENERAL,negative
,None was made so i hung up.,SERVICE#GENERAL,negative
,Less than three minutes passed before I found myself doubled over the toilet.,FOOD#QUALITY,negative
,"My girlfriend, being slightly more aggressive, and having been equally disgusted causing her to throw out the remainder of her barely eaten meal, called back only to be informed that I was probably wrong and that it was most likely an oyster, and that we were also blacklisted from their restaurant.",FOOD#QUALITY,negative
,,SERVICE#GENERAL,negative
,"Not only have I worked in restaurants for many years, I am now in culinary school, I am a huge lover of oysters and fish, and my girlfriend is half Korean!",,
,We know the difference between and oyster and bad fish.,,
,"It wasn't as if this restaurant had any major bragging points before hand, but now it's simply repulsive.",RESTAURANT#GENERAL,negative
,Eat at your own risk.,FOOD#QUALITY,negative
CLF#7,Gorgeous place ideal for a romantic dinner,AMBIENCE#GENERAL,positive
,,RESTAURANT#MISCELLANEOUS,positive
,I took my boyfriend for a dinner on saturday night.,,
,I book a gorgeous white organza tent which included a four course prix fix menu which we enjoyed a lot.,FOOD#QUALITY,positive
,,AMBIENCE#GENERAL,positive
,The service was spectacular as the waiter knew everything about the menu and his recommendations were amazing!,SERVICE#GENERAL,positive
,,SERVICE#GENERAL,positive
,I completely recommend Casa La Femme for any special occasion and to REALLY impress your date.,RESTAURANT#MISCELLANEOUS,positive
DBG#7,More Williamsburg Garbage,RESTAURANT#GENERAL,negative
,My wife and I visited Dokebi tonight.,,
,We ordered dosut bibimbap and nakgi-bokum.,,
,The dishes came out around 5 minutes apart.,SERVICE#GENERAL,negative
,"The bibimbap was average, but the stone bowl wasn't even close to sizzling.",FOOD#QUALITY,neutral
,,FOOD#STYLE_OPTIONS,negative
,Too bad I had paid an extra $2 for the stone bowl.,FOOD#PRICES,negative
,The nakgi-bokum was horrible.,FOOD#QUALITY,negative
,Easily the worst stir-fried squid I've ever tasted.,FOOD#QUALITY,negative
,The sauce tasted more like Chinese fast food than decent Korean.,FOOD#QUALITY,negative
,"The side dishes were passable, and I did get a refill upon request.",FOOD#QUALITY,neutral
,,FOOD#STYLE_OPTIONS,neutral
,The real problem I had with this place was the complete lack of service.,SERVICE#GENERAL,negative
,I mentioned the squid dish wasn't very good when the waitress visited.,,
,She just nodded and walked off.,SERVICE#GENERAL,negative
,"There were no communications issues either, as she spoke perfect English.",,
,"As to my comment about the food, no apology or acknowledgment was made.",SERVICE#GENERAL,negative
,My wife had barely touched that mess of a dish.,FOOD#QUALITY,negative
,We were charged full price.,SERVICE#GENERAL,negative
,"If you ware looking for Korean fusion, I suggest you try some of the places in the East Village.",,
,"Authentic Korean food lovers should visit 32nd Street, of course.",,
ADLT#9,Lives up to the hype,RESTAURANT#GENERAL,positive
,We've lived around the corner from this place for over a year and finally had dinner there.,,
,We've tried before but it always packed and doesn't take reservations.,RESTAURANT#MISCELLANEOUS,neutral
,It was well worth the wait.,RESTAURANT#GENERAL,positive
,The wife had the risotto which was amazing.,FOOD#QUALITY,positive
,"It doesn't look appetizing as it's covered in squid ink and it turns your lips and teeth black, but the taste was phenomenal.",FOOD#STYLE_OPTIONS,negative
,,FOOD#QUALITY,positive
,The farro salad and the mashed yukon potatoes were also extremely tasty.,FOOD#QUALITY,positive
,,FOOD#QUALITY,positive
EVPK#4,i love margherita pizza  i looove east village pizza,RESTAURANT#GENERAL,positive
,,FOOD#QUALITY,positive
,"Love this place, every time we are in the city this is one of the places we always go.",RESTAURANT#GENERAL,positive
,A quintessential slice of NYC pizza.,FOOD#QUALITY,neutral
,"The crust has a great bite and a good chew, the sauce is light with a nice acidity to it, the salt from the cheese is great, really heightens the flavor of all the other components.",FOOD#QUALITY,positive
,,FOOD#QUALITY,positive
,,FOOD#QUALITY,positive
,"Personally I like the margherita pizza better, but they are all good.",FOOD#QUALITY,positive
,,FOOD#QUALITY,positive
Z#6,Possibly the Most Romantic Restaurant in the City,AMBIENCE#GENERAL,positive
,"This is undoubtedly my favorite modern Japanese brasserie (that dont serve sushi), and in my opinion, one of the most romantic restaurants in the city!",RESTAURANT#GENERAL,positive
,,AMBIENCE#GENERAL,positive
,"Not only is it an adventure getting to this somewhat hidden spot, once you enter the unmarked wooden doors, the zen and intimate dcor will make you feel like youre no longer in the city.",LOCATION#GENERAL,neutral
,,AMBIENCE#GENERAL,positive
,,AMBIENCE#GENERAL,positive
,"If youre planning to come here, make sure that your date is someone whom you really like since youll be ushered to private booths where there will be no people or food watching (choose the ones on the ground level that have glass ceilings so you may see the stars in the sky!).",AMBIENCE#GENERAL,positive
,,AMBIENCE#GENERAL,positive
,Its just you and your date and an occasional cute excuse me before the waiter opens the little curtain to your booth!,AMBIENCE#GENERAL,positive
,,SERVICE#GENERAL,positive
,"My party had the BBE $29 fixe prix menu, which was such a wonderful deal since it also came with a flight of sake!",FOOD#PRICES,positive
,,FOOD#STYLE_OPTIONS,positive
,I never used to be a fan of sakes but am lately experimenting with it a lot more and am acquiring a better taste of it.,,
,We started off with a delightful sashimi amuse bouche.,FOOD#QUALITY,positive
,Our first course was Tuna Sashimi with Green Yuzu Sauce.,,
,"I picked the Grilled Black Cod as my entree, which I absolutely devoured while someone commented that the Grilled Salmon dish was better.",FOOD#QUALITY,positive
,,FOOD#QUALITY,positive
,The entrees were served with miso soup and rice.,,
,The sakes complimented the courses very well and is successfully easing me into the sake world.,DRINKS#QUALITY,positive
,"For desserts, we tried the frozen black sesame mousse (interesting but not extraordinary) and matcha (powdered green tea) and blueberry cheesecake, which was phenomenal.",FOOD#QUALITY,neutral
,,FOOD#QUALITY,positive
,"Maybe it was the great company (I had friends visiting from Philly  yes, it was not a date this time) or the super reasonable price point, but I just cant say enough good things about this brasserie.",RESTAURANT#GENERAL,positive
,,RESTAURANT#PRICES,positive
,"I dont usually visit the same establishment more than once, what more twice, but Ill come to Zenkichi anytime for a quiet, unhurried and memorable dinner.",RESTAURANT#GENERAL,positive
,,AMBIENCE#GENERAL,positive
CLF#6,Terrible would be a compliment!,RESTAURANT#GENERAL,negative
,"The service leaves much to be desired, from feeling like you are rushed the place your order, to being ignored the rest of the night.",SERVICE#GENERAL,negative
,"We were 10 people celebrtating a birthday, we sat in the tent.",,
,We paid a fixed pricce but got nothing!!,SERVICE#GENERAL,negative
,We never ate because by close to 2 in the monring we were not served and were too upset ad tired to start eating.,SERVICE#GENERAL,negative
,"They are extremely rude, not even apologizing for the horrible service we got and handing us a bill well over $500 for some drinks adn their pita bread!",SERVICE#GENERAL,negative
,,DRINKS#PRICES,negative
,,FOOD#PRICES,negative
,,SERVICE#GENERAL,negative
,Stay away,RESTAURANT#GENERAL,negative
DBG#6,Great Shabu Shabu,FOOD#QUALITY,positive
,"I go here at least once every other week, particularly when it's cold!",,
,I love it.,RESTAURANT#GENERAL,positive
,To be honest we only ever eat the Shabu Shabu.,,
,I tried a couple other dishes but wasn't too impressed.,FOOD#QUALITY,neutral
,"But for the Shabu Shabu, you won't find much better in NY.",FOOD#QUALITY,positive
,In fact there is only one I've tried that even compares (shabu Tatsu) and even then I prefer Dokebi.,,
,"The meat is fresh, the sauces are great, you get kimchi and a salad free with your meal and service is good too.",FOOD#QUALITY,positive
,,FOOD#QUALITY,positive
,,SERVICE#GENERAL,positive
,,FOOD#STYLE_OPTIONS,positive
,,FOOD#PRICES,positive
,,FOOD#PRICES,positive
DBG#1,Dokebi gives Williamsburg the right one-two punch of classic Korean food and fusion twists like pork belly tacos.,FOOD#QUALITY,positive
,,FOOD#QUALITY,positive
,,FOOD#QUALITY,positive
BHD#1,"The hot dogs are good, yes, but the reason to get over here is the fantastic pork croquette sandwich, perfect on its supermarket squishy bun.",FOOD#QUALITY,positive
,,FOOD#QUALITY,positive
,,FOOD#QUALITY,positive
TR#5,Restaurant with a view,LOCATION#GENERAL,neutral
,Celebrated my fathers birthday here.,,
,The food tasted very good.,FOOD#QUALITY,positive
,The family seafood entree was very good.,FOOD#QUALITY,positive
,The main entree was also very good.,FOOD#QUALITY,positive
,We order a bit of everything on the menu.,,
,"Price is high but the food is good, so I would come back again.",FOOD#QUALITY,positive
,,FOOD#PRICES,negative
,,RESTAURANT#GENERAL,positive
Z#7,This place doesn't make any sense,RESTAURANT#GENERAL,negative
,Just want to warn you all - don't waste your time and money.,RESTAURANT#GENERAL,negative
,"This place has totally weird decor, stairs going up with mirrored walls - I am surprised how no one yet broke their head or fall off the stairs - mirrored walls make you dizzy and delusional...",AMBIENCE#GENERAL,negative
,,AMBIENCE#GENERAL,negative
,This place is not inviting and the food is totally weird.,AMBIENCE#GENERAL,negative
,,FOOD#QUALITY,negative
,The concept of japanese tapas is newly created and clearly doesn't work.,FOOD#STYLE_OPTIONS,negative
,"The food they serve is not comforting, not appetizing and uncooked.",FOOD#QUALITY,negative
,Go to japanese sushi place or Spanish tapas place - this creation in Williamsburg is a misstake.,,
Z#10,Good Food,FOOD#QUALITY,positive
,I went here with my boyfriend for our anniversary.,,
,"The food was great and tasty, but the sitting space was too small, I don't like being cramp in a corner.",FOOD#QUALITY,positive
,,AMBIENCE#GENERAL,negative
,Over all it was a very nice romantic place .,RESTAURANT#GENERAL,positive
,,AMBIENCE#GENERAL,positive
,I would recommend to ask for a bigger sitting area when you make a reservation (if possible),,
P#7,Loved it,RESTAURANT#GENERAL,positive
,A coworker and I tried Pacifico after work a few Fridays and loved it.,RESTAURANT#GENERAL,positive
,The atmosphere was great.,AMBIENCE#GENERAL,positive
,"The food we ordered was excellent, although I wouldn't say the margaritas were anything to write home about.",FOOD#QUALITY,positive
,,DRINKS#QUALITY,neutral
,"Our waitress wasn't mean, but not especially warm or attentive either.",SERVICE#GENERAL,neutral
,"I must say I am surprised by the bad reviews of the restaurant earlier in the year, though.",RESTAURANT#GENERAL,positive
,Maybe it has improved since then?,,
,"Regardless, we'll be back and can't wait to visit in the summer to take advantage of the patio.",AMBIENCE#GENERAL,positive
,,RESTAURANT#GENERAL,positive
FF#4,Dumbfoundingly Poor,RESTAURANT#GENERAL,negative
,"This was, from start to finish, a mind-bogglingly uncomfortable experience.",RESTAURANT#GENERAL,negative
,Lexicographers take note: a new and fascinating definition of rudeness is alive and flourishing right here in Brooklyn.,SERVICE#GENERAL,negative
,The servers at Flatbush Farm appear to have perfected that ghastly technique of making you feel guilty and ashamed for deigning to attract their attention.,SERVICE#GENERAL,negative
,Polite acknowledgement is out;,SERVICE#GENERAL,negative
,supercilious scorn is in.,SERVICE#GENERAL,negative
,"And how many times can you pick up the same perfectly aligned set of napkins, inspect them vapidly and plonk them down in exactly the same place instead of venturing a glance at people who are there to help you make the rent?",SERVICE#GENERAL,negative
,"A different server enhanced the fun, dumping our entrees in front of us halfway through our appetizer (which was delicious).",SERVICE#GENERAL,negative
,,FOOD#QUALITY,positive
,"Overall the food quality was pretty good, though I hear the salmon is much better when it hasn't sat cooling in front of the guest.",FOOD#QUALITY,positive
,,SERVICE#GENERAL,negative
,"The place has a nice fit-out, some attractive furnishings and, from what I could tell, a reasonable wine list (I was given the food menu when I asked for the carte des vins)",AMBIENCE#GENERAL,positive
,,AMBIENCE#GENERAL,positive
,,DRINKS#STYLE_OPTIONS,positive
,,SERVICE#GENERAL,negative
,"At $120 for two people, however, this in no way represents value, unless you're looking to pay by the hour for passive-aggressive torture.",RESTAURANT#PRICES,negative
,,RESTAURANT#GENERAL,negative
,,SERVICE#GENERAL,negative
,"On that scale, it's a world-beater.",RESTAURANT#GENERAL,negative
FF#3,How is this palce still open?,RESTAURANT#GENERAL,negative
,I honestly don't even know where to begin.,RESTAURANT#GENERAL,negative
,"My boyfriend and I are avid restaurant goers, and we are always on the lookout for new places and our friend had recommended Flatbush Farms.",,
,"We arrived and were seated immediately, which made us both happy.",SERVICE#GENERAL,positive
,"We ordered our appetizers, I ordered the chicken and my boyfriend the salmon.",,
,Everything was going good until we got our meals.,RESTAURANT#GENERAL,positive
,,FOOD#QUALITY,negative
,I took one look at the chicken and I was appalled.,FOOD#STYLE_OPTIONS,negative
,"It was served with skin, over a bed of extremely undercooked spinach and mashed potatoes.",FOOD#STYLE_OPTIONS,negative
,,FOOD#QUALITY,negative
,"My boyfriend asked me if I wanted to switch and eat his salmon instead, while he de-skinned the chicken so that I could enjoy the white meat.",,
,"I took one bite from the $24 salmon, and I have never, in the 17 years I have been going to restaurants tasted salmon as fishy, as dry, and as bland as the one in Flatbush Farms.",FOOD#QUALITY,negative
,,FOOD#PRICES,negative
,"At this point, the waitress comes over and asks us if everything was okay, I was literally so shocked that I was speechless and didn't say anything, and guess what, the waitress WALKED away.",SERVICE#GENERAL,negative
,"So, I switch with my boyfriend again to see if maybe I could stomach the meat and spinach again, but the spinach was so undercooked that I just could not bite through it.",FOOD#QUALITY,negative
,I couldn't even enjoy the mashed potatoes because it was hidden completely under the chicken and spinach.,FOOD#STYLE_OPTIONS,negative
,I've had better chicken at BBQs!!!!,,
,So I decide to report back to the waitress because it was completely inedible.,FOOD#QUALITY,negative
,"Guess what, I waited for TWENTY minutes before she came over and when she finally did, she says, ""oh well, I wish you would have said something earlier"" No apology, nothing.",SERVICE#GENERAL,negative
,"After that she simply took our plates, walked away, came back another TWENTY minutes later with the bill and the chicken on it!!!!!!!!!!!!",SERVICE#GENERAL,negative
,"No desert menu, no apology, nothing!!!!!!",SERVICE#GENERAL,negative
,"I was literally going to explode, but instead, my boyfriend took the bill and went to find the manager.",,
,"This is where it really really gets bad: the manager said, there is absolutely nothing we can do, it's a matter of taste that she didn't like it, and I cannot comp it.",SERVICE#GENERAL,negative
,"Again, no apology, no is there anything else I can get you, no can I get you a drink to make up for it, nothing!!!!",SERVICE#GENERAL,negative
,We refused to pay for it because at this point it had nothing to do with the food anymore.,,
,The level of rudeness was preposterous.,SERVICE#GENERAL,negative
,"The manager came to the table and said we can do what we want, so we paid for what we did enjoy, the drinks and appetizers, and walked out.",SERVICE#GENERAL,negative
,,DRINKS#QUALITY,positive
,,FOOD#QUALITY,positive
,I HAVE NEVER EVER HAD SUCH AN UNPLEASANT EXPERIENCE.,RESTAURANT#GENERAL,negative
,THIS STAFF SHOULD BE FIRED.,SERVICE#GENERAL,negative
EVPK#9,cirspy crust margherita pizza,FOOD#QUALITY,positive
,we have been there 3 times since last week we alked it by chance first day the manager offerd us the margherita pizza adn we said yes.,,
,it was really good pizza.,FOOD#QUALITY,positive
,the crust was imazingly cooked well and pizza was fully loaded:):):),FOOD#QUALITY,positive
,,FOOD#STYLE_OPTIONS,positive
,you know what i mean all the positives things happening there made mw write this review.,RESTAURANT#GENERAL,positive
CLF#4,Single Worst Restaurant in Manhattan,RESTAURANT#GENERAL,negative
,"I'll being with a couple of positives: cool decor, good pita and hummus, and grilled octopus that was actually pretty tasty.",AMBIENCE#GENERAL,positive
,,FOOD#QUALITY,positive
,,FOOD#QUALITY,positive
,,FOOD#QUALITY,positive
,Moving on.,,
,If I could give 0 stars I would do so for this place.,RESTAURANT#GENERAL,negative
,Casa La Femme is to middle eastern dining what Chuckie Cheeze is to italian.,,
,The reason there are 4 different results on citysearch for the same place is because they keep trying to start a new thread so they can stock it with positive reviews.,RESTAURANT#MISCELLANEOUS,negative
,Well...they can run but they can't hide.,RESTAURANT#GENERAL,negative
,I live in the West Village and I've been to a lot of restaurants.,,
,"Sometimes you pay a lot and don't get much in return - it's manhattan, things are expensive.",,
,"However, most of them are at least prompt and pleasant.",,
,This place...god where do i begin.,RESTAURANT#GENERAL,negative
,It is quite a spectacular scene i'll give them that.,AMBIENCE#GENERAL,positive
,The decor however seems to be the distraction so you won't notice that you just payed 300 bucks for some cold eggplant that took 2 FRICKIN HOURS TO COME!!!!,AMBIENCE#GENERAL,neutral
,,FOOD#QUALITY,negative
,,FOOD#PRICES,negative
,,SERVICE#GENERAL,negative
,"How this place survives the competitive west village market in this economy, or any other for that matter, is beyond me.",RESTAURANT#GENERAL,negative
BHD#4,Great Hot Dogs!,FOOD#QUALITY,positive
,I've made the trip out here a few times with a friend who lives nearby (I live on UWS).,,
,"Though it's been crowded most times I've gone here, Bark always delivers on their food.",FOOD#QUALITY,positive
,,RESTAURANT#MISCELLANEOUS,neutral
,"The hot dogs are top notch, and they're Slamwich is amazing!",FOOD#QUALITY,positive
,,FOOD#QUALITY,positive
,"Going to Bark is always worth the train ride, and will make your tongue and belly very happy!",RESTAURANT#GENERAL,positive
,,FOOD#QUALITY,positive
,Only complaint is the pricing--I believe it would be more reasonable to pay a dollar less on each item listed on the menu.,FOOD#PRICES,negative
,"But nonetheless--great spot, great food.",RESTAURANT#GENERAL,positive
,,FOOD#QUALITY,positive
BFC#7,Fabulous food - if the front of house staff don't put you off ,FOOD#QUALITY,positive
,,SERVICE#GENERAL,negative
,We live nearby BFC.,,
,"It's a little out of our price range for dining there except on special occasions, but we've eaten there 6 times in the last 2 years. ",RESTAURANT#PRICES,negative
,"Each time we've been, the front of house staff (not the waiters - they're fantastic - but the people who greet and seat you) has been so hideous to us that were it not for the exceptional fish dishes I would never return. ",SERVICE#GENERAL,positive
,,SERVICE#GENERAL,negative
,,FOOD#QUALITY,positive
,"As BFC doesn't take reservations you almost always have to wait by the bar - and be abused by the front of house staff until you are seated, which can be over an hour later!",RESTAURANT#MISCELLANEOUS,negative
,,SERVICE#GENERAL,negative
,,SERVICE#GENERAL,negative
,The frizzy retro girl (with winged/ Dame Edna glasses) will yell at you if you try to order a drink.,SERVICE#GENERAL,negative
,"I was almost amused by the fact that she was turning away customers at 9pm on a Friday night because she ""had a BBQ to go to"" that night - WTF??",SERVICE#GENERAL,negative
,I'd be horrified if my staff were turning away customers so early and so rudely!,SERVICE#GENERAL,negative
,"There's another girl who I can't describe, she is about 5'6"" with brown hair, who eavesdrops on your conversation and chimes in - except she only hears the last part of what you said, so her uninvited opinions are often out of context and nothing to do with what you're *really* talking about. ",SERVICE#GENERAL,negative
,"I'm a friendly person, so I wouldn't mind had she not been so nasty and gotten so personal. ",SERVICE#GENERAL,negative
,"Again, I'd be super upset if that were my employee.",SERVICE#GENERAL,negative
,"Considering you will spend at least $60 a head, I expect better service. ",SERVICE#GENERAL,negative
,,RESTAURANT#PRICES,negative
,"So, if you're walking by and thinking about dining, you might want to see who's going to be seating you first...",SERVICE#GENERAL,negative
ADLT#6,"Maitre-D-""Eat and get out""",SERVICE#GENERAL,negative
,My family ate here last weekend.,,
,"The food and service were fine, however the maitre-D was incredibly unwelcoming and arrogant.",FOOD#QUALITY,positive
,,SERVICE#GENERAL,positive
,,SERVICE#GENERAL,negative
,"While finishing our meals which included a high-end bottle of wine, our son's fiance joined us for a glass of wine and dessert.",DRINKS#QUALITY,positive
,"This guy refused to seat her and she left, followed shortly by the four of us, but not before I told him that in my 40 years of world travel, including Paris, that I had never seen such a display of bad behavior by a frontman in a restaurant.",SERVICE#GENERAL,negative
,"His response was smug, arrogant, and condescending, totally consistent with his deportment on display all evening.",SERVICE#GENERAL,negative
,"A word to the wise: you can't dine here and disturb the maitre-D's sense of "" table turnover"", as whacked as it is, or else.",SERVICE#GENERAL,negative
,"If you go here, do it on his off-night.",SERVICE#GENERAL,negative
NP#9,Best meal in a long time!,FOOD#QUALITY,positive
,Mussles and calamari were superb Saturday evening.,FOOD#QUALITY,positive
,,FOOD#QUALITY,positive
,I had the Lamb special which was perfect.,FOOD#QUALITY,positive
,"My father had the flank steak which was very good, and my mother had the swordfish.",FOOD#QUALITY,positive
TFS#2,The Four Seasons restaurant is a great experience.,RESTAURANT#GENERAL,positive
,The food is great and the environment is even better.,FOOD#QUALITY,positive
,,AMBIENCE#GENERAL,positive
,Everyone must come here at least once.,RESTAURANT#GENERAL,positive
,Highly recommend it!,RESTAURANT#GENERAL,positive
BHD#8,Taking Hot Dogs to the next level,FOOD#QUALITY,positive
,"At first glance this place seems a bit pricey for a hot dog joint, but at Bark you don't just get your average hot dog.",RESTAURANT#PRICES,negative
,,FOOD#QUALITY,positive
,Here the hot dog is elevated to the level of a real entree with numerous variations available.,FOOD#QUALITY,positive
,,FOOD#STYLE_OPTIONS,positive
P#3,Great Atmosphere,AMBIENCE#GENERAL,positive
,Went to this place this place on a real cold night and needed a quick meal.,,
,"I highly recommend the fish tacos, everything else was ok.",FOOD#QUALITY,positive
,,FOOD#QUALITY,neutral
,"Cool atmosphere, the fire place in the back really ads to it but needs a bit more heat throughout on a cold night.",AMBIENCE#GENERAL,positive
,,AMBIENCE#GENERAL,positive
,,AMBIENCE#GENERAL,negative
CLF#8,Poor service and management,SERVICE#GENERAL,negative
,,SERVICE#GENERAL,negative
,Dont go to this place!,RESTAURANT#GENERAL,negative
,Had an awful experience at Casa la Femme on a Saturday dinner.,RESTAURANT#GENERAL,negative
,Appetizers took nearly an hour.,SERVICE#GENERAL,negative
,When the main course finally arrived (another 45mins) half of our order was missing.,SERVICE#GENERAL,negative
,Never got an explanation as to what was going on.,SERVICE#GENERAL,negative
,The manager was rude and handled the situation extremely poorly.,SERVICE#GENERAL,negative
,"When we threatened to leave, we were offered a meager discount even though half the order was missing.",SERVICE#GENERAL,negative
,"On the way out, we heard of other guests complaining about similar issues.",SERVICE#GENERAL,negative
