rid,sentences__sentence__text,sentences__sentence__Opinions__Opinion__category,sentences__sentence__Opinions__Opinion__polarity
,,AMBIENCE#GENERAL,neutral
,The restaurant is a bit noisy but that is something that can be overlooked once you sit down and enjoy a great meal,FOOD#QUALITY,positive
,,AMBIENCE#GENERAL,neutral
505535,this little place has a cute interior decor and affordable city prices.,AMBIENCE#GENERAL,positive
,,RESTAURANT#PRICES,positive
,"the pad se ew chicken was delicious, however the pad thai was far too oily.",FOOD#QUALITY,positive
,,FOOD#QUALITY,negative
,i would just ask for no oil next time.,,
507755,"Have eaten at Ginger House several times, and it's always good.",RESTAURANT#GENERAL,positive
,The fried dumplings are GREAT!,FOOD#QUALITY,positive
,Finally a reliable Chinese restaurant!,RESTAURANT#GENERAL,positive
507844,This place would be so much better served by being run by a group that actually understands customer service.,SERVICE#GENERAL,negative
,"The only thing you can do here is walk in and eat .. but planning an event, especially a small, intimate one, forget about it.",RESTAURANT#MISCELLANEOUS,negative
,"They are not helpful in the least and will give you the grand run around so by the time the event date rolls around you will not only regret chosing this place, but also become hostile!",SERVICE#GENERAL,negative
,"Nobody at this restaurant will give firm answers about anything and in the end, not one person takes responsibility for anything.",SERVICE#GENERAL,negative
,"Terrible, terrible management - deserves to be shut-down.",SERVICE#GENERAL,negative
,,RESTAURANT#GENERAL,negative
507937,Never fails to please.,RESTAURANT#GENERAL,positive
,"delicious bagels, especially when right out of the oven.",FOOD#QUALITY,positive
,Spreads and toppings are great - though a bit pricey.,FOOD#QUALITY,positive
,,FOOD#QUALITY,positive
,,FOOD#PRICES,negative
,,FOOD#PRICES,negative
,Service is fast and friendly.,SERVICE#GENERAL,positive
,"Only drawback - they won't toast your bagel, and they don't make eggs for the bagel.",SERVICE#GENERAL,negative
,But that is highly forgivable.,SERVICE#GENERAL,positive
509227,"Been there, done that, and New York, it's not that big a deal.",RESTAURANT#GENERAL,neutral
,"The food is decent at best, and the ambience, well, it's a matter of opinion, some may consider it to be a sweet thing, I thought it was just annoying.",FOOD#QUALITY,negative
,,AMBIENCE#GENERAL,negative
,"If celebrities make you sweat, then your in for a ride, but if your like most around these parts then you'll just yawn and wonder whats with all the hype.",RESTAURANT#MISCELLANEOUS,negative
,"Rao is a good restaurant, but it's nothing special.",RESTAURANT#GENERAL,neutral
511290,I've eaten at many different Indian restaurants.,,
,"But after last night, Spice Grill is the only place I'm eating indian cuisine.",FOOD#QUALITY,positive
,You must try the shrimp appetizers.,FOOD#QUALITY,positive
,Even my Indian friend couldn't believe how good and tasty everything was.,FOOD#QUALITY,positive
,This place has the the correct ambience and an excellent staff to make you feel like a guest and a friend at the same time.,AMBIENCE#GENERAL,positive
,,SERVICE#GENERAL,positive
512294,"Great food, great prices, great service.",FOOD#QUALITY,positive
,,RESTAURANT#PRICES,positive
,,SERVICE#GENERAL,positive
,"If you are looking for a good quality, cheap eats - this is the place.",FOOD#QUALITY,positive
,,FOOD#PRICES,positive
512925,it's a perfect place to have a amanzing indian food.,FOOD#QUALITY,positive
,I really loved the different and inovated touch that's the cheff gives to the food.,FOOD#STYLE_OPTIONS,positive
,"also it's great to have dinner in a very romantic and confortable place, the service it's just perfect...they're so frendly that we never want to live the place!",AMBIENCE#GENERAL,positive
,,SERVICE#GENERAL,positive
513395,"I love Ess-a-bagel, but I live on the west side, so I often go to Murray's for convenience.",,
,"Their bagels are fine, but they are a little overcooked, and not really a 'special' bagel experience.",FOOD#QUALITY,negative
,"Better than the bagel shop on the corner, but not worth going out of your way for, in my opinion.",,
,Also a little more expensive than your average bagel place.,,
513521,Great bagels made the old-fashioned way.,FOOD#QUALITY,positive
,,FOOD#STYLE_OPTIONS,positive
,The appetizing is excellent - just as good as Zabars Barney Greengrass at a reasonable price (if bought by the pound).,,
,Drawbacks: service is slow and they don't toast!,SERVICE#GENERAL,negative
519425,The food was absolutely amazing!!,FOOD#QUALITY,positive
,The baked clams octopus we shared as appetizers were the best we've ever had!!,FOOD#QUALITY,positive
,"The lamb was tender so full of flavor, the dessert was divine!!",FOOD#QUALITY,positive
,,FOOD#QUALITY,positive
,The waiter was attentive.,SERVICE#GENERAL,positive
,The place itself is beautiful the bar scene seems to be happening.,AMBIENCE#GENERAL,positive
,,AMBIENCE#GENERAL,positive
521916,"Downtown Dinner 2002 - Prixe fix: Appetizers were ok, waiter gave me poor suggestion..try the potato stuff kanish best one.",FOOD#QUALITY,neutral
,,SERVICE#GENERAL,negative
,,FOOD#QUALITY,positive
,"Small servings for main entree, i had salmon (wasnt impressed) girlfriend had chicken, it was good.",FOOD#QUALITY,negative
,,FOOD#QUALITY,positive
,,FOOD#STYLE_OPTIONS,negative
,Dessert is a joke...dont bother,FOOD#QUALITY,negative
527109,"Volare virgins or weekly regulars, everyone gets treated the same and you can't ask for more than that when the service is this friendly.",SERVICE#GENERAL,positive
,"The restaurant has a Family feel, not least with regard to the portions which are enormous; the veal alone could have single-handedly solved third world famine.",AMBIENCE#GENERAL,positive
,,FOOD#STYLE_OPTIONS,positive
,,FOOD#STYLE_OPTIONS,positive
,"The anti-pasta was excellent, especially the calamari, as were the filling pasta mains.",FOOD#QUALITY,positive
,,FOOD#QUALITY,positive
,,FOOD#QUALITY,positive
,,FOOD#STYLE_OPTIONS,positive
,The wine list is extensive and can easily hike up an otherwise reasonably priced meal.,DRINKS#STYLE_OPTIONS,positive
,,FOOD#PRICES,positive
,"Still, any quibbles about the bill were off-set by the pour-your-own measures of liquers which were courtesey of the house...",RESTAURANT#PRICES,neutral
,,DRINKS#STYLE_OPTIONS,positive
528251,Fantastic place.,RESTAURANT#GENERAL,positive
,Cute and decorative.,AMBIENCE#GENERAL,positive
,A pleasant surprise.,RESTAURANT#GENERAL,positive
,Go there to relax and feel like your somewhere else.,AMBIENCE#GENERAL,positive
530517,Lucky Strike is a great casual place to just grab a bite to eat.,RESTAURANT#GENERAL,positive
,"Yeah the crowd can take it a bit seriously, but it shouldn't.",,
,"Great food, great decor, great service.",FOOD#QUALITY,positive
,,AMBIENCE#GENERAL,positive
,,SERVICE#GENERAL,positive
,I recommend it!,RESTAURANT#GENERAL,positive
,Just ignore the trendy wannabes.,,
535086,"This is the perfect spot for meeting friends, having lunch, dinner, pre-theatre or after-theatre drinks!",RESTAURANT#MISCELLANEOUS,positive
,(Always ask the bartender for the SEASONAL beer!!!,DRINKS#QUALITY,positive
,Guaranteed to be a tasty experience!),DRINKS#QUALITY,positive
,Excellent spot for holiday get togethers with co-workers or friends that you haven't seen in a while.,RESTAURANT#MISCELLANEOUS,positive
,I have been doing all of the above at the Heartland Brewery for over 5 years now and I HAVE NEVER BEEN DISAPPOINTED!,RESTAURANT#GENERAL,positive
,All the people that I bring there go back on their own and bring THEIR friends!,RESTAURANT#MISCELLANEOUS,positive
,Go there once and oh yes...you will go back...you will...,RESTAURANT#GENERAL,positive
535171,What a great place!,RESTAURANT#GENERAL,positive
,Not the typical NYC gimmick theme restaurant.,AMBIENCE#GENERAL,positive
,"A cool bar with great food, and tons of excellent beer.",AMBIENCE#GENERAL,positive
,,FOOD#QUALITY,positive
,,DRINKS#QUALITY,positive
,,DRINKS#STYLE_OPTIONS,positive
,And even with it's Pub atmosphere they were great to my kids too!,SERVICE#GENERAL,positive
,Loved it!,RESTAURANT#GENERAL,positive
535248,"Out of the hundreds of Italian restaurants in Queens, this is among the best.",,
,The shrimp scampi was excellent and the antipasti were plentiful.,FOOD#QUALITY,positive
,,FOOD#STYLE_OPTIONS,positive
,It is expensive but well worth the money.,RESTAURANT#PRICES,negative
,,RESTAURANT#GENERAL,positive
,"If you venture off the island of Manhattan and can't seem to find a great Italian restaurant, drive to Corona.",RESTAURANT#GENERAL,positive
536919,The only thing more wonderful than the food (which is exceptional) is the service.,FOOD#QUALITY,positive
,,SERVICE#GENERAL,positive
,The only thing the waiters don't do for you is wipe your chin when you leave.,SERVICE#GENERAL,positive
,Wonderful at holiday time.,RESTAURANT#MISCELLANEOUS,positive
541532,Cozy romantic atomosphere with only around 15 tables at most.,AMBIENCE#GENERAL,positive
,Service was very prompt but slightly rushed.,SERVICE#GENERAL,positive
,,SERVICE#GENERAL,negative
,"Food was very good, but not what I would consider out of this world.",FOOD#QUALITY,neutral
,Go here for a romantic dinner but not for an all out wow dining experience.,AMBIENCE#GENERAL,positive
,,RESTAURANT#MISCELLANEOUS,negative
553097,My friend from Milan and myself were pleasantly surprised when we arrived and everyone spoke italian.,RESTAURANT#MISCELLANEOUS,positive
,Too bad the food wasn't of the same heritage.,FOOD#QUALITY,negative
,"The porcini mushroom pasta special was tasteless, so was the seafood tagliatelle.",FOOD#QUALITY,negative
,,FOOD#QUALITY,negative
,A real dissapointment.,FOOD#QUALITY,negative
,But that wasn't the icing on the cake: a tiramisu that resembled nothing I have ever had.,FOOD#QUALITY,negative
,They should have called it mascarpone with chocolate chips-good but a far cry from what the name implies.,FOOD#QUALITY,negative
,Priced at upper intermediate range.,RESTAURANT#PRICES,negative
555734,I really liked this place.,RESTAURANT#GENERAL,positive
,"Everything I had was good, and I'm a eater.",FOOD#QUALITY,positive
,It was pretty inexpensive too.,RESTAURANT#PRICES,positive
558423,This place has the best Chinese style BBQ ribs in the city.,FOOD#QUALITY,positive
,,FOOD#STYLE_OPTIONS,positive
,I also recommend the rice dishes or the different varieties of congee (rice porridge).,FOOD#QUALITY,positive
,,FOOD#QUALITY,positive
,It's great to go for a quick lunch either alone or with a friend.,RESTAURANT#MISCELLANEOUS,positive
,It's definately not a place to go if you want to impress someone.,RESTAURANT#MISCELLANEOUS,negative
,"However, if you want great food at a great price and don't mind the decor, you can't beat this place.",FOOD#QUALITY,positive
,,AMBIENCE#GENERAL,neutral
,,FOOD#PRICES,positive
,Quick and friendly service.,SERVICE#GENERAL,positive
,This is one of the best comfort food places in the city.,RESTAURANT#GENERAL,positive
,It's somewhere you can eat and be happy.,RESTAURANT#GENERAL,positive
561054,"When I'm feeling stressed by the noise and congestion around my office, I head for Cafe St. Bart's.",,
,"When you're sitting in their main dining room (which has a spectacular, hand-painted high ceiling) you'd never know there was a world outside.",AMBIENCE#GENERAL,positive
,,AMBIENCE#GENERAL,positive
,"The food is wonderful, tasty and filling, and the service is professional and friendly.",FOOD#QUALITY,positive
,,FOOD#STYLE_OPTIONS,positive
,,SERVICE#GENERAL,positive
,"I can't wait for summer, when they serve outside on their gigantic patio.",AMBIENCE#GENERAL,positive
,Ahhh...,,
565344,I recently tried Suan and I thought that it was great.,RESTAURANT#GENERAL,positive
,This little place definitely exceeded my expectations and you sure get a lot of food for your money.,FOOD#STYLE_OPTIONS,positive
,,RESTAURANT#GENERAL,positive
,,FOOD#PRICES,positive
,The service was fast and friendly and the food was very tasty and they had the best hot sauce to add to your meals.,SERVICE#GENERAL,positive
,,FOOD#QUALITY,positive
,,FOOD#QUALITY,positive
,I have to say that I am pleasantly suprised and I will most likely stop in again if I am in the neighborhood.,RESTAURANT#GENERAL,positive
571962,They all know you.,SERVICE#GENERAL,positive
,Good food.,FOOD#QUALITY,positive
,Good drink.,DRINKS#QUALITY,positive
,How do you rate home?,RESTAURANT#MISCELLANEOUS,positive
578016,I have never had cheescake like this.,FOOD#QUALITY,positive
,I thought I had died and gone to heaven.,FOOD#QUALITY,positive
584025,"Great spot, whether looking for a couple of drinks or quiet dinner.",RESTAURANT#GENERAL,positive
,,RESTAURANT#MISCELLANEOUS,positive
,Warm and friendly in the winter and terrific outdoor seating in the warmer months.,AMBIENCE#GENERAL,positive
,,AMBIENCE#GENERAL,positive
,The food is great and they have a good selecion of wines at reasonable prices.,FOOD#QUALITY,positive
,,DRINKS#STYLE_OPTIONS,positive
,,DRINKS#PRICES,positive
,Have been several times and it never dissapoints.,RESTAURANT#GENERAL,positive
608500,"After hearing a lot of great things about the restaurant, and passing by it on a daily basis, we decided to try.",,
,We were less than impressed.,RESTAURANT#GENERAL,negative
,"While the ambiance and atmosphere were great, the food and service could have been a lot better.",AMBIENCE#GENERAL,positive
,,AMBIENCE#GENERAL,positive
,,FOOD#QUALITY,negative
,,SERVICE#GENERAL,negative
,"We ordered the chicken casserole, but what we got were a few small pieces of chicken, all dark meat and on the bone.",FOOD#QUALITY,negative
,,FOOD#STYLE_OPTIONS,negative
,Probably would not go again...,RESTAURANT#GENERAL,negative
610611,"i've been to sapphire twice and both times the food was fine, if not good.",FOOD#QUALITY,positive
,"stick with the chicken, beef, and lamb dishes.",FOOD#QUALITY,positive
,,FOOD#QUALITY,positive
,,FOOD#QUALITY,positive
,i don't usually order wine with indian so i can't comment on their wine list or their wines.,,
,instead ordered an ice cold beer which to me works with indian.,,
,"service is friendly, and never had a problem walking in and getting a table.",SERVICE#GENERAL,positive
,,RESTAURANT#MISCELLANEOUS,positive
,i would recommend reservations on weekends though.,,
,skip dessert.,FOOD#QUALITY,negative
611117,Best Reuben sandwich ever!,FOOD#QUALITY,positive
,A classic!,FOOD#QUALITY,positive
,Don't miss Bloom's on your next trip to Manhatten.,RESTAURANT#GENERAL,positive
,"It was the first place we ate on our first trip to New York, and it will be the last place we stop as we head out of town on our next trip to New York.",RESTAURANT#MISCELLANEOUS,positive
,Thanks Bloom's for a lovely trip.,RESTAURANT#GENERAL,positive
615180,"As a fan of Thai, I have tried quite a few different restaurants in NYC and this one was definitely the worst.",,
,"The food was not fresh, the sauces were bland and very oily.",FOOD#QUALITY,negative
,,FOOD#QUALITY,negative
,It just wasn't Thai.,FOOD#QUALITY,negative
620892,Went to Ottimo and was expecting outstanding pizza (as I love La Pizza Fresca).,,
,Was surprisingly disappointed.,FOOD#QUALITY,negative
,Pizza was a little soggy.,FOOD#QUALITY,negative
,Ravioli was good...but I have to say that I found everything a bit overpriced.,FOOD#QUALITY,positive
,,FOOD#PRICES,negative
,Not enough wines by the glass either.,DRINKS#STYLE_OPTIONS,negative
,"Service, however, was excellent...and I liked the setting/atmosphere a lot. ",SERVICE#GENERAL,positive
,,AMBIENCE#GENERAL,positive
,"Food was just average...if they lowered the prices just a bit, it would be a bigger draw.",FOOD#QUALITY,neutral
,,FOOD#PRICES,negative
624715,This place is a great bargain.,RESTAURANT#PRICES,positive
,Authentic Pakistani food.,FOOD#QUALITY,positive
,People are always friendly.,SERVICE#GENERAL,positive
,Don't waste money on decor.,AMBIENCE#GENERAL,neutral
,"Just straight up cheap, good food.",FOOD#QUALITY,positive
,,FOOD#PRICES,positive
626269,Faan is sooo good.,RESTAURANT#GENERAL,positive
,The best pad thai i've ever had.,FOOD#QUALITY,positive
,The design and atmosphere is just as good.,AMBIENCE#GENERAL,positive
,,AMBIENCE#GENERAL,positive
,bottles of wine are cheap and good.,DRINKS#PRICES,positive
,,DRINKS#QUALITY,positive
,What more could you want?,RESTAURANT#GENERAL,positive
630914,The food was actually aweful.,FOOD#QUALITY,negative
,I'm not picky - but it was actually gross.,FOOD#QUALITY,negative
,"The mussles were the fishiest things I've ever tasted, the seabass was bland, the goat cheese salad was missing the goat cheese, the penne w/ chicken had bones in it... It was disgusting.",FOOD#QUALITY,negative
,,FOOD#QUALITY,negative
,,FOOD#QUALITY,negative
,,FOOD#QUALITY,negative
,,FOOD#QUALITY,negative
,"Nice atmosphere, the service was very pleasant and the desert was good.",AMBIENCE#GENERAL,positive
,,SERVICE#GENERAL,positive
,,FOOD#QUALITY,positive
,Wouldn't recomend it for dinner!,RESTAURANT#GENERAL,negative
632121,This is the perfect date spot for Williamsburg couples.,RESTAURANT#MISCELLANEOUS,positive
,The jukebox plays everything from Italian Opera to The Strokes.,AMBIENCE#GENERAL,positive
,"The food is amazing, rich pastas and fresh doughy pizza.",FOOD#QUALITY,positive
,,FOOD#STYLE_OPTIONS,positive
,,FOOD#QUALITY,positive
,"Best of all is the warm vibe, the owner is super friendly and service is fast.",AMBIENCE#GENERAL,positive
,,SERVICE#GENERAL,positive
,,SERVICE#GENERAL,positive
,"If only they delivered, they'd make a mint!",RESTAURANT#MISCELLANEOUS,neutral
657129,go here for the drinks!,DRINKS#QUALITY,positive
,esp. during happy hour!,,
,enough said!,,
,the drinks are amazing and half off till 8pm.,DRINKS#QUALITY,positive
,,DRINKS#PRICES,positive
,"Ask for Usha, the nicest bartender in manhattan.",SERVICE#GENERAL,positive
,My fav was the sassy lassi...,DRINKS#QUALITY,positive
680345,This is an amazing place to try some roti rolls.,FOOD#QUALITY,positive
,I really recommend the very simple Unda (Egg) rolls.,FOOD#QUALITY,positive
,"Delicate spices, onions, eggs and a kick-ass roti.",FOOD#QUALITY,positive
,,FOOD#QUALITY,positive
,,FOOD#QUALITY,positive
,,FOOD#QUALITY,positive
,Amazing!,FOOD#QUALITY,positive
680390,"Toons has recently been redone, so it's now a very attractive space.",AMBIENCE#GENERAL,positive
,The food's as good as ever.,FOOD#QUALITY,positive
,"In an area sadly lacking in decent Thai food, this is one of the best spots.",FOOD#QUALITY,positive
682250,"Went here last night - nice decor, good service, but the food was surprisingly excellent.",AMBIENCE#GENERAL,positive
,,SERVICE#GENERAL,positive
,,FOOD#QUALITY,positive
,"The portions are HUGE, so it might be good to order three things to split (rather than one appetizer and entree per person) for two people.",FOOD#STYLE_OPTIONS,positive
,"Among all of the new 5th avenue restaurants, this offers by far one of the best values for your money.",,
,Can't wait to go back.,RESTAURANT#GENERAL,positive
682391,Best drumsticks over rice and sour spicy soup in town!,FOOD#QUALITY,positive
,,FOOD#QUALITY,positive
,Beef noodle soup is good as well.,FOOD#QUALITY,positive
,The service is good and the resturant is clean.,SERVICE#GENERAL,positive
,,AMBIENCE#GENERAL,positive
,Best Taiwanese food in NY!,FOOD#QUALITY,positive
707917,I have been to Rao's probably 15 times the past 3 years and it keeps getting better.,RESTAURANT#GENERAL,positive
,"For those that go once and don't enjoy it, all I can say is that they just don't get it.",RESTAURANT#GENERAL,positive
,Rao's has the best service and atmosphere in NYC.,SERVICE#GENERAL,positive
,,AMBIENCE#GENERAL,positive
,Good luck getting a table.,RESTAURANT#MISCELLANEOUS,neutral
709294,My roommate and I LOVE this place.,RESTAURANT#GENERAL,positive
,"We recently decided to try this location, and to our delight, they have outdoor seating, perfect since I had my yorkie with me.",AMBIENCE#GENERAL,positive
,Indoor was very cozy and cute.,AMBIENCE#GENERAL,positive
,"The portion sizes here are huge, and the sushi is good.",FOOD#STYLE_OPTIONS,positive
,,FOOD#QUALITY,positive
,"While it's not Nobu, it sure is a great deal and you definitely will leave feeling satisfied and full.",,
,Staff is very accomodating.,SERVICE#GENERAL,positive
713152,"Excellent dumplings served amid clean, chic decor.",FOOD#QUALITY,positive
,,AMBIENCE#GENERAL,positive
,"I got the $10 10-piece dim sum combo, every bite of which was great.",FOOD#QUALITY,positive
,But $1 for each small piece???,FOOD#PRICES,negative
,Not worth it.,FOOD#PRICES,negative
,I won't go back unless someone else is footing the bill.,RESTAURANT#GENERAL,negative
,,RESTAURANT#PRICES,negative
717570,I came here with my boyfriend for our anniversary because it was highly recommended to him by a friend.,,
,The decor is very simple but comfortable.,AMBIENCE#GENERAL,positive
,The food was delicious but do not come here on a empty stomach.,FOOD#QUALITY,positive
,,FOOD#STYLE_OPTIONS,negative
,The portions are small but being that the food was so good makes up for that.,FOOD#STYLE_OPTIONS,negative
,,FOOD#QUALITY,positive
,You must have the crabmeat lasagna which is out of this world and the chocolate bread pudding for dessert.,FOOD#QUALITY,positive
,,FOOD#QUALITY,positive
,The staff there is very attentive and down to earth.,SERVICE#GENERAL,positive
,I loved it and would go again.,RESTAURANT#GENERAL,positive
720418,Great Indian food and the service is incredible.,FOOD#QUALITY,positive
,,SERVICE#GENERAL,positive
,The owner truly caters to all your needs.,SERVICE#GENERAL,positive
,"When family came in he gave them apps to test their palets, and then ordered for them.",SERVICE#GENERAL,positive
,Everyone was more then happy with his choices.,SERVICE#GENERAL,positive
,Great food and the prices are very reasonable.,FOOD#QUALITY,positive
,,RESTAURANT#PRICES,positive
720620,"Obviously the Chinese translation of this place does not mean Big Wong, it actually means Great Prosperity.",,
,The food here does a great service to the name (Cantonese that is...).,FOOD#QUALITY,positive
,I fell in love with the egg noodles in the beef broth with shrimp dumplings and slices of BBQ roast pork.,FOOD#QUALITY,positive
,This dish is my favorite and I always get it when I go there and never get tired of it.,FOOD#QUALITY,positive
,"Try the congee and the donut like deep fried dough they call Ow Ley Soh, a delicious and sweet tasting bread.",FOOD#QUALITY,positive
,,FOOD#QUALITY,positive
,Simply some good tasting Chinese food at incredible prices...,FOOD#QUALITY,positive
,,FOOD#PRICES,positive
,Service is not what you are coming here for...,SERVICE#GENERAL,negative
,Just make sure my ice water is kept full and my tea kettle filled with piping hot tea and that's all the service I need...,,
,Big Wong is a great place to eat and fill your stomach.,RESTAURANT#GENERAL,positive
735448,this place... we stumbled upon it on labor day weekend.,,
,"whoever the jazz duo was, they were on POINT.",AMBIENCE#GENERAL,positive
,"good music, great food, speedy service affordable prices.",AMBIENCE#GENERAL,positive
,,FOOD#QUALITY,positive
,,SERVICE#GENERAL,positive
,,RESTAURANT#PRICES,positive
,even the wine by the glass was good.,DRINKS#QUALITY,positive
,"its a little out of the way if you don't live in the neighborhood, but definitely worth the trip from wherever you are.",LOCATION#GENERAL,neutral
,,RESTAURANT#GENERAL,positive
737999,Consistently good Japanese Tapas.,FOOD#QUALITY,positive
,"Same owner as the guy who owns Typhoon, which is just down the street on St. Marks and 1st Ave.",,
,Always good drinks and service is pretty good;,DRINKS#QUALITY,positive
,,SERVICE#GENERAL,positive
,Atmosphere is nice and relaxed too...,AMBIENCE#GENERAL,positive
,A great place to meet up for some food and drinks...,RESTAURANT#MISCELLANEOUS,positive
,Yakitori (bbq meats) is tasty too.,FOOD#QUALITY,positive
,"It's also attached to Angel's Share, which is a cool, more romantic bar...",,
740923,Just moved to the neighborhood and we've been trying all the West Village Sushi restaurants.,,
,"If you don't mind pre-sliced low quality fish, unfriendly staff and a sushi chef that looks like he is miserable then this is your place.",FOOD#QUALITY,negative
,,SERVICE#GENERAL,negative
,,RESTAURANT#MISCELLANEOUS,negative
,Price and quality of fish alone will keep us from making a return visit.,FOOD#PRICES,negative
,,FOOD#QUALITY,negative
,,RESTAURANT#GENERAL,negative
,Wasn't going to share but I feel obligated...while sitting at the sushi bar dining we watched the chef accidentally drop a piece of Unagi on the floor and upon retrieving it from the floor proceed to use the piece in the delivery order he was preparing.,FOOD#QUALITY,negative
,No thanks!!!,RESTAURANT#GENERAL,negative
744478,"This place, which is only a few months old, is perhaps Queens' biggest secret!",RESTAURANT#GENERAL,positive
,"Fabulous decor - makes you feel like you're in a trendy Manhattan restaurant, very very good food, cheaply-priced, generally friendly staff, and if you're a Manhattanite, or spend most of your time in Manhattan, Rice Avenue will make you feel at home.....very Soho/Village/Upper West Side minus the expensive prices and pretentious clientele.....all on Roosevelt Avenue!",AMBIENCE#GENERAL,positive
,,FOOD#QUALITY,positive
,,FOOD#PRICES,positive
,,SERVICE#GENERAL,positive
,,AMBIENCE#GENERAL,positive
,,LOCATION#GENERAL,positive
,,RESTAURANT#PRICES,positive
746254,We were seated outside and the waiter spilled red wine and hot tea on myself and my date.,SERVICE#GENERAL,negative
